{"$id":"https://awesome-self-skills.local/schemas/v5-canonical-array-manifest.schema.json","$schema":"https://json-schema.org/draft/2020-12/schema","additionalProperties":false,"properties":{"entries":{"items":false,"maxItems":42,"minItems":42,"prefixItems":[{"additionalProperties":false,"properties":{"json_pointer":{"const":"/accepted_source_payload_digests"},"semantics":{"const":"set"},"sort_key":{"const":"$canonical"},"unique_key":{"const":"$canonical"}},"required":["json_pointer","semantics","unique_key","sort_key"],"type":"object"},{"additionalProperties":false,"properties":{"json_pointer":{"const":"/affected_refs"},"semantics":{"const":"set"},"sort_key":{"const":"$canonical"},"unique_key":{"const":"$canonical"}},"required":["json_pointer","semantics","unique_key","sort_key"],"type":"object"},{"additionalProperties":false,"properties":{"json_pointer":{"const":"/ambiguity_reviews"},"semantics":{"const":"set"},"sort_key":{"const":"candidate_id"},"unique_key":{"const":"candidate_id"}},"required":["json_pointer","semantics","unique_key","sort_key"],"type":"object"},{"additionalProperties":false,"properties":{"json_pointer":{"const":"/applied_clarification_impact/decision_ids"},"semantics":{"const":"set"},"sort_key":{"const":"$canonical"},"unique_key":{"const":"$canonical"}},"required":["json_pointer","semantics","unique_key","sort_key"],"type":"object"},{"additionalProperties":false,"properties":{"json_pointer":{"const":"/basis"},"semantics":{"const":"set"},"sort_key":{"const":"$canonical"},"unique_key":{"const":"$canonical"}},"required":["json_pointer","semantics","unique_key","sort_key"],"type":"object"},{"additionalProperties":false,"properties":{"json_pointer":{"const":"/cases/steps"},"position_key":{"const":"$position"},"semantics":{"const":"sequence"}},"required":["json_pointer","semantics","position_key"],"type":"object"},{"additionalProperties":false,"properties":{"json_pointer":{"const":"/clarification_presentation/parts"},"position_key":{"const":"$position"},"semantics":{"const":"sequence"}},"required":["json_pointer","semantics","position_key"],"type":"object"},{"additionalProperties":false,"properties":{"json_pointer":{"const":"/clarification_preview/bindings"},"semantics":{"const":"set"},"sort_key":{"const":"unit_client_key"},"unique_key":{"const":"unit_client_key"}},"required":["json_pointer","semantics","unique_key","sort_key"],"type":"object"},{"additionalProperties":false,"properties":{"json_pointer":{"const":"/client_key_bindings"},"semantics":{"const":"set"},"sort_key":{"const":"client_key"},"unique_key":{"const":"client_key"}},"required":["json_pointer","semantics","unique_key","sort_key"],"type":"object"},{"additionalProperties":false,"properties":{"json_pointer":{"const":"/clusters"},"semantics":{"const":"set"},"sort_key":{"const":"$canonical"},"unique_key":{"const":"$canonical"}},"required":["json_pointer","semantics","unique_key","sort_key"],"type":"object"},{"additionalProperties":false,"properties":{"json_pointer":{"const":"/clusters/mentions"},"semantics":{"const":"set"},"sort_key":{"const":"mention_candidate_id"},"unique_key":{"const":"mention_candidate_id"}},"required":["json_pointer","semantics","unique_key","sort_key"],"type":"object"},{"additionalProperties":false,"properties":{"json_pointer":{"const":"/decomposition_reviews"},"semantics":{"const":"set"},"sort_key":{"const":"candidate_id"},"unique_key":{"const":"candidate_id"}},"required":["json_pointer","semantics","unique_key","sort_key"],"type":"object"},{"additionalProperties":false,"properties":{"json_pointer":{"const":"/entity_conflict_groups"},"semantics":{"const":"set"},"sort_key":{"const":"conflict_group_id"},"unique_key":{"const":"conflict_group_id"}},"required":["json_pointer","semantics","unique_key","sort_key"],"type":"object"},{"additionalProperties":false,"properties":{"json_pointer":{"const":"/entity_conflict_groups/mention_candidate_ids"},"semantics":{"const":"set"},"sort_key":{"const":"$canonical"},"unique_key":{"const":"$canonical"}},"required":["json_pointer","semantics","unique_key","sort_key"],"type":"object"},{"additionalProperties":false,"properties":{"json_pointer":{"const":"/entity_resolutions"},"semantics":{"const":"set"},"sort_key":{"const":"conflict_group_id"},"unique_key":{"const":"conflict_group_id"}},"required":["json_pointer","semantics","unique_key","sort_key"],"type":"object"},{"additionalProperties":false,"properties":{"json_pointer":{"const":"/exact_mention_candidate_ids"},"semantics":{"const":"set"},"sort_key":{"const":"$canonical"},"unique_key":{"const":"$canonical"}},"required":["json_pointer","semantics","unique_key","sort_key"],"type":"object"},{"additionalProperties":false,"properties":{"json_pointer":{"const":"/fsm/action_templates"},"semantics":{"const":"set"},"sort_key":{"const":"template_id"},"unique_key":{"const":"template_id"}},"required":["json_pointer","semantics","unique_key","sort_key"],"type":"object"},{"additionalProperties":false,"properties":{"json_pointer":{"const":"/fsm/cells"},"semantics":{"const":"set"},"sort_key":{"const":"cell_id"},"unique_key":{"const":"cell_id"}},"required":["json_pointer","semantics","unique_key","sort_key"],"type":"object"},{"additionalProperties":false,"properties":{"json_pointer":{"const":"/fsm/cells/successor_cell_ids"},"semantics":{"const":"set"},"sort_key":{"const":"$canonical"},"unique_key":{"const":"$canonical"}},"required":["json_pointer","semantics","unique_key","sort_key"],"type":"object"},{"additionalProperties":false,"properties":{"json_pointer":{"const":"/fsm/outcomes"},"semantics":{"const":"set"},"sort_key":{"const":"outcome_id"},"unique_key":{"const":"outcome_id"}},"required":["json_pointer","semantics","unique_key","sort_key"],"type":"object"},{"additionalProperties":false,"properties":{"json_pointer":{"const":"/fsm/read_only_profiles"},"semantics":{"const":"set"},"sort_key":{"const":"profile_id"},"unique_key":{"const":"profile_id"}},"required":["json_pointer","semantics","unique_key","sort_key"],"type":"object"},{"additionalProperties":false,"properties":{"json_pointer":{"const":"/idempotency_index/entries"},"semantics":{"const":"set"},"sort_key":{"const":"idempotency_key"},"unique_key":{"const":"idempotency_key"}},"required":["json_pointer","semantics","unique_key","sort_key"],"type":"object"},{"additionalProperties":false,"properties":{"json_pointer":{"const":"/ledger/dispositions"},"semantics":{"const":"set"},"sort_key":{"const":"request_id"},"unique_key":{"const":"request_id"}},"required":["json_pointer","semantics","unique_key","sort_key"],"type":"object"},{"additionalProperties":false,"properties":{"json_pointer":{"const":"/ledger/next_batch_request_ids"},"semantics":{"const":"set"},"sort_key":{"const":"$canonical"},"unique_key":{"const":"$canonical"}},"required":["json_pointer","semantics","unique_key","sort_key"],"type":"object"},{"additionalProperties":false,"properties":{"json_pointer":{"const":"/pending/canonical_units"},"semantics":{"const":"set"},"sort_key":{"const":"unit_client_key"},"unique_key":{"const":"unit_client_key"}},"required":["json_pointer","semantics","unique_key","sort_key"],"type":"object"},{"additionalProperties":false,"properties":{"json_pointer":{"const":"/pending/decision_proposals"},"semantics":{"const":"set"},"sort_key":{"const":"question_part_id"},"unique_key":{"const":"question_part_id"}},"required":["json_pointer","semantics","unique_key","sort_key"],"type":"object"},{"additionalProperties":false,"properties":{"json_pointer":{"const":"/permission_scope_groups"},"semantics":{"const":"set"},"sort_key":{"const":"scope_group_id"},"unique_key":{"const":"scope_group_id"}},"required":["json_pointer","semantics","unique_key","sort_key"],"type":"object"},{"additionalProperties":false,"properties":{"json_pointer":{"const":"/permission_scope_groups/permission_scope_candidate_ids"},"semantics":{"const":"set"},"sort_key":{"const":"$canonical"},"unique_key":{"const":"$canonical"}},"required":["json_pointer","semantics","unique_key","sort_key"],"type":"object"},{"additionalProperties":false,"properties":{"json_pointer":{"const":"/permission/coordinate_resolutions"},"semantics":{"const":"set"},"sort_key":{"const":"coordinate"},"unique_key":{"const":"coordinate"}},"required":["json_pointer","semantics","unique_key","sort_key"],"type":"object"},{"additionalProperties":false,"properties":{"json_pointer":{"const":"/permission/unresolved_coordinates"},"semantics":{"const":"set"},"sort_key":{"const":"$permission-coordinate-order"},"unique_key":{"const":"$permission-coordinate-order"}},"required":["json_pointer","semantics","unique_key","sort_key"],"type":"object"},{"additionalProperties":false,"properties":{"json_pointer":{"const":"/question_part_state_set/parts"},"semantics":{"const":"set"},"sort_key":{"const":"question_part_id"},"unique_key":{"const":"question_part_id"}},"required":["json_pointer","semantics","unique_key","sort_key"],"type":"object"},{"additionalProperties":false,"properties":{"json_pointer":{"const":"/question_part_state/transition_history"},"position_key":{"const":"transition_sequence"},"semantics":{"const":"sequence"}},"required":["json_pointer","semantics","position_key"],"type":"object"},{"additionalProperties":false,"properties":{"json_pointer":{"const":"/request_dispositions"},"semantics":{"const":"set"},"sort_key":{"const":"request_id"},"unique_key":{"const":"request_id"}},"required":["json_pointer","semantics","unique_key","sort_key"],"type":"object"},{"additionalProperties":false,"properties":{"json_pointer":{"const":"/request_ids"},"semantics":{"const":"set"},"sort_key":{"const":"$canonical"},"unique_key":{"const":"$canonical"}},"required":["json_pointer","semantics","unique_key","sort_key"],"type":"object"},{"additionalProperties":false,"properties":{"json_pointer":{"const":"/risk_reviews"},"semantics":{"const":"set"},"sort_key":{"const":"$module-risk"},"unique_key":{"const":"$module-risk"}},"required":["json_pointer","semantics","unique_key","sort_key"],"type":"object"},{"additionalProperties":false,"properties":{"json_pointer":{"const":"/selectors"},"semantics":{"const":"set"},"sort_key":{"const":"$canonical"},"unique_key":{"const":"$canonical"}},"required":["json_pointer","semantics","unique_key","sort_key"],"type":"object"},{"additionalProperties":false,"properties":{"json_pointer":{"const":"/source_bootstrap/source_request_seeds"},"semantics":{"const":"set"},"sort_key":{"const":"source_request_client_key"},"unique_key":{"const":"source_request_client_key"}},"required":["json_pointer","semantics","unique_key","sort_key"],"type":"object"},{"additionalProperties":false,"properties":{"json_pointer":{"const":"/source_pack/sources/units"},"position_key":{"const":"$position"},"semantics":{"const":"sequence"}},"required":["json_pointer","semantics","position_key"],"type":"object"},{"additionalProperties":false,"properties":{"json_pointer":{"const":"/source_packs"},"semantics":{"const":"set"},"sort_key":{"const":"artifact_digest"},"unique_key":{"const":"artifact_digest"}},"required":["json_pointer","semantics","unique_key","sort_key"],"type":"object"},{"additionalProperties":false,"properties":{"json_pointer":{"const":"/source_payload/source_pack/sources"},"semantics":{"const":"set"},"sort_key":{"const":"source_client_key"},"unique_key":{"const":"source_client_key"}},"required":["json_pointer","semantics","unique_key","sort_key"],"type":"object"},{"additionalProperties":false,"properties":{"json_pointer":{"const":"/source_requests"},"semantics":{"const":"set"},"sort_key":{"const":"request_id"},"unique_key":{"const":"request_id"}},"required":["json_pointer","semantics","unique_key","sort_key"],"type":"object"},{"additionalProperties":false,"properties":{"json_pointer":{"const":"/stable_id_preimage_registry/rows"},"semantics":{"const":"set"},"sort_key":{"const":"object_kind"},"unique_key":{"const":"object_kind"}},"required":["json_pointer","semantics","unique_key","sort_key"],"type":"object"}],"type":"array"},"manifest_digest":{"const":"sha256:5f30c3459b30ca3098483d96253132e7ee3a0df3e9a1100ff52e40aaa2246956"},"manifest_format_version":{"const":1},"schema_version":{"const":"5.0.0"}},"required":["schema_version","manifest_format_version","entries","manifest_digest"],"type":"object"}
