{"entries":[{"json_pointer":"/accepted_source_payload_digests","semantics":"set","sort_key":"$canonical","unique_key":"$canonical"},{"json_pointer":"/affected_refs","semantics":"set","sort_key":"$canonical","unique_key":"$canonical"},{"json_pointer":"/ambiguity_reviews","semantics":"set","sort_key":"candidate_id","unique_key":"candidate_id"},{"json_pointer":"/applied_clarification_impact/decision_ids","semantics":"set","sort_key":"$canonical","unique_key":"$canonical"},{"json_pointer":"/basis","semantics":"set","sort_key":"$canonical","unique_key":"$canonical"},{"json_pointer":"/cases/steps","position_key":"$position","semantics":"sequence"},{"json_pointer":"/clarification_presentation/parts","position_key":"$position","semantics":"sequence"},{"json_pointer":"/clarification_preview/bindings","semantics":"set","sort_key":"unit_client_key","unique_key":"unit_client_key"},{"json_pointer":"/client_key_bindings","semantics":"set","sort_key":"client_key","unique_key":"client_key"},{"json_pointer":"/clusters","semantics":"set","sort_key":"$canonical","unique_key":"$canonical"},{"json_pointer":"/clusters/mentions","semantics":"set","sort_key":"mention_candidate_id","unique_key":"mention_candidate_id"},{"json_pointer":"/decomposition_reviews","semantics":"set","sort_key":"candidate_id","unique_key":"candidate_id"},{"json_pointer":"/entity_conflict_groups","semantics":"set","sort_key":"conflict_group_id","unique_key":"conflict_group_id"},{"json_pointer":"/entity_conflict_groups/mention_candidate_ids","semantics":"set","sort_key":"$canonical","unique_key":"$canonical"},{"json_pointer":"/entity_resolutions","semantics":"set","sort_key":"conflict_group_id","unique_key":"conflict_group_id"},{"json_pointer":"/exact_mention_candidate_ids","semantics":"set","sort_key":"$canonical","unique_key":"$canonical"},{"json_pointer":"/fsm/action_templates","semantics":"set","sort_key":"template_id","unique_key":"template_id"},{"json_pointer":"/fsm/cells","semantics":"set","sort_key":"cell_id","unique_key":"cell_id"},{"json_pointer":"/fsm/cells/successor_cell_ids","semantics":"set","sort_key":"$canonical","unique_key":"$canonical"},{"json_pointer":"/fsm/outcomes","semantics":"set","sort_key":"outcome_id","unique_key":"outcome_id"},{"json_pointer":"/fsm/read_only_profiles","semantics":"set","sort_key":"profile_id","unique_key":"profile_id"},{"json_pointer":"/idempotency_index/entries","semantics":"set","sort_key":"idempotency_key","unique_key":"idempotency_key"},{"json_pointer":"/ledger/dispositions","semantics":"set","sort_key":"request_id","unique_key":"request_id"},{"json_pointer":"/ledger/next_batch_request_ids","semantics":"set","sort_key":"$canonical","unique_key":"$canonical"},{"json_pointer":"/pending/canonical_units","semantics":"set","sort_key":"unit_client_key","unique_key":"unit_client_key"},{"json_pointer":"/pending/decision_proposals","semantics":"set","sort_key":"question_part_id","unique_key":"question_part_id"},{"json_pointer":"/permission_scope_groups","semantics":"set","sort_key":"scope_group_id","unique_key":"scope_group_id"},{"json_pointer":"/permission_scope_groups/permission_scope_candidate_ids","semantics":"set","sort_key":"$canonical","unique_key":"$canonical"},{"json_pointer":"/permission/coordinate_resolutions","semantics":"set","sort_key":"coordinate","unique_key":"coordinate"},{"json_pointer":"/permission/unresolved_coordinates","semantics":"set","sort_key":"$permission-coordinate-order","unique_key":"$permission-coordinate-order"},{"json_pointer":"/question_part_state_set/parts","semantics":"set","sort_key":"question_part_id","unique_key":"question_part_id"},{"json_pointer":"/question_part_state/transition_history","position_key":"transition_sequence","semantics":"sequence"},{"json_pointer":"/request_dispositions","semantics":"set","sort_key":"request_id","unique_key":"request_id"},{"json_pointer":"/request_ids","semantics":"set","sort_key":"$canonical","unique_key":"$canonical"},{"json_pointer":"/risk_reviews","semantics":"set","sort_key":"$module-risk","unique_key":"$module-risk"},{"json_pointer":"/selectors","semantics":"set","sort_key":"$canonical","unique_key":"$canonical"},{"json_pointer":"/source_bootstrap/source_request_seeds","semantics":"set","sort_key":"source_request_client_key","unique_key":"source_request_client_key"},{"json_pointer":"/source_pack/sources/units","position_key":"$position","semantics":"sequence"},{"json_pointer":"/source_packs","semantics":"set","sort_key":"artifact_digest","unique_key":"artifact_digest"},{"json_pointer":"/source_payload/source_pack/sources","semantics":"set","sort_key":"source_client_key","unique_key":"source_client_key"},{"json_pointer":"/source_requests","semantics":"set","sort_key":"request_id","unique_key":"request_id"},{"json_pointer":"/stable_id_preimage_registry/rows","semantics":"set","sort_key":"object_kind","unique_key":"object_kind"}],"manifest_digest":"sha256:5f30c3459b30ca3098483d96253132e7ee3a0df3e9a1100ff52e40aaa2246956","manifest_format_version":1,"schema_version":"5.0.0"}
